Highnote,https://www.crunchbase.com/organization/highnote-platform,Emerging Unicorn,"Credit Cards, FinTech, Information Technology, Payments, Transaction Processing","San Francisco, California, United States",Highnote is an embedded finance company that develops a virtual payment platform to handle payment processing business flows.,"John MacIlwaine, Kin Kee",194000000,USD,194000000,Series B,2025-01-21,Early Stage Venture,5,https://highnote.com,"Oak HC/FT, Adams Street Partners, XYZ Venture Capital, Pinegrove Capital Partners, Costanoa Ventures","9,329",,-27.38%,101-250
Cosmose,https://www.crunchbase.com/organization/cosmose,Emerging Unicorn,"Analytics, Artificial Intelligence (AI), Big Data, Location Based Services, Machine Learning, Retail","Singapore, Central Region, Singapore",Cosmose AI empowers oCommerce by synergizing offline and online for omnichannel and influence.,Miron Mironiuk,27000000,USD,27000000,Venture - Series Unknown,2023-04-24,,6,http://cosmose.co,"NEAR, OTB Ventures, Founders Factory, Experior Venture Fund, Tiga Investments","9,300",,222.47%,51-100
IQM Quantum Computers,https://www.crunchbase.com/organization/iqm,Emerging Unicorn,"Computer, Hardware, Product Design, Quantum Computing","Espoo, Southern Finland, Finland","IQM builds quantum computers, focusing on superconducting technology.","Jan Goetz, Juha Vartiainen, Kuan Yen Tan, Mikko Möttönen",233750000,EUR,249121255,Series A,2024-02-28,Early Stage Venture,8,https://www.meetiqm.com/,"European Investment Bank, Tencent, OurCrowd, European Innovation Council, Vsquared Ventures","9,289","25,868.17",-25%,251-500
Pragmatic Semiconductor,https://www.crunchbase.com/organization/pragmatic-semiconductor,Emerging Unicorn,"Electronics, Foundries, Internet of Things, Manufacturing, Product Design, Semiconductor","Cambridge, Cambridgeshire, United Kingdom",Pragmatic is a ultra-low-cost flexible electronics enabling novel solutions not practical with conventional electronics,"Richard Price, Scott White",389309010,USD,389309010,Series D,2023-12-06,Late Stage Venture,11,https://www.pragmaticsemi.com,"National Wealth Fund, Northern Gritstone, Amcor, Touchdown Ventures, Future Planet Capital","9,196",,49.61%,251-500
AeroFarms,https://www.crunchbase.com/organization/aerofarms,Emerging Unicorn,"Agriculture, AgTech, CleanTech, Hospitality","Newark, New Jersey, United States","AeroFarms, B Corp leader in Indoor Vertical Farming, growing produce using up to 95% less water and no pesticides ever.","David Rosenberg, Ed Harwood, Marc Oshima",313735624,USD,313735624,Venture - Series Unknown,2024-04-24,,12,http://www.aerofarms.com,"nvp capital, GSR Ventures, Cibus Fund, AllianceBernstein, Abu Dhabi Investment Office (ADIO)","8,783",,47.94%,101-250
Bizongo,https://www.crunchbase.com/organization/bizongo,Emerging Unicorn,"Apparel, B2B, E-Commerce, Packaging Services, Supply Chain Management","Mumbai, Maharashtra, India","Bizongo develops tech-enabled B2B platforms for raw material procurement, vendor digitization, supply chain financing, and ESG scorecards.","Aniket Deb, Ankit Tomar, Sachin Agrawal",334793557,USD,334793557,Series E,2025-03-11,Late Stage Venture,13,https://bizongo.com,"B Capital, Accel, International Finance Corporation, Tiger Global Management, InnoVen Capital","8,718",,31.72%,251-500
Auradine,https://www.crunchbase.com/organization/auradine,Emerging Unicorn,"Blockchain, Information Technology, Infrastructure, Security","Santa Clara, California, United States","Auradine provides web infrastructure solutions encompassing blockchain, artificial intelligence, and privacy technologies.","Barun Kar, Rajiv Khemani",314000000,USD,314000000,Series C,2025-04-16,Late Stage Venture,5,https://auradine.com,"StepStone Group, Mayfield Fund, Cota Capital, Celesta Capital, DCVC","8,428",,51.42%,101-250
Monarch Tractor,https://www.crunchbase.com/organization/monarch-tractors,Emerging Unicorn,"Agriculture, AgTech, Analytics, Artificial Intelligence (AI), Electric Vehicle, Farming","Livermore, California, United States","Monarch Tractor creates fully electric, autonomous tractors designed to enhance productivity, sustainability, and safety in agriculture.","Carlo Mondavi, Mark Schwager, Praveen Penmetsa, Zachary Omohundro",214000000,USD,214000000,Series C,2024-08-19,Late Stage Venture,5,https://monarchtractor.com,"At One Ventures, California Energy Commission, Astanor Ventures, CNH Industrial, MUUS","8,081",,34.33%,251-500
Musicow,https://www.crunchbase.com/organization/musicow,Emerging Unicorn,"Marketplace, Music, Music Streaming, Online Portals","Seoul, Seoul-t'ukpyolsi, South Korea",Musicow allows investors to buy or sell stakes in copyrights to K-Pop songs in a public auction or an online marketplace.,,185000000000,KRW,146565251,Series D,2023-05-23,Late Stage Venture,6,https://www.musicow.com,"Premier Partners, STIC Investment, Korea Development Bank, WYSIWYG Studio, LB Investment","8,062","612,751.83",-78.54%,51-100
Progcap,https://www.crunchbase.com/organization/progcap,Emerging Unicorn,"Enterprise, Finance, Financial Services, FinTech","New Delhi, Delhi, India",Progcap is a financial service company that provides financial opportunities for micro and small businesses.,"Himanshu Chandra, Pallavi Shrivastava",150624557,USD,150624557,Series C,2022-10-17,Late Stage Venture,7,http://www.progcap.com,"Google, Venture Catalysts, Peak XV Partners, Tiger Global Management, 100Unicorns","7,783",,81.89%,251-500
Greenlabs,https://www.crunchbase.com/organization/greenlabsglobal,Emerging Unicorn,"Agriculture, AgTech, Farming, Software","Seoul, Seoul-t'ukpyolsi, South Korea",Greenlabs is an agri-tech company that provides a digital agricultural platform for farm management.,"Luke Donghyun Ahn, Sang Hoon Shin, Scott Sungwoo Choi",235299442,USD,235299442,Series C,2023-03-30,Late Stage Venture,6,https://www.greenlabs.co.kr,"Hashed, BRV Capital Management, Magna Investment, SK Square, Mainstreet Investment","7,733",,78.59%,501-1000
UVeye,https://www.crunchbase.com/organization/uveye,Emerging Unicorn,"Artificial Intelligence (AI), Automotive, Industrial Automation, Machine Learning","Teaneck, New Jersey, United States",UVeye is a computer vision company that develops automated inspection systems for vehicles.,"Amir Hever, Ohad Hever",386500000,USD,386500000,Series D,2025-01-29,Late Stage Venture,8,http://www.uveye.com,"Trinity Capital, General Motors, Woven Capital, CarMax, Hyundai Motor Company","7,701",,-77.38%,101-250
Upwind Security,https://www.crunchbase.com/organization/upwind-security,Emerging Unicorn,"Cloud Infrastructure, Cloud Management, Cloud Security, Information Technology, Software","San Francisco, California, United States",Upwind Security provides cybersecurity solutions to protect organizations from digital threats and vulnerabilities.,"Amiram Shachar, Lavi Ferdman, Liran Polak",180000000,USD,180000000,Series A,2024-12-02,Early Stage Venture,3,https://www.upwind.io,"Craft Ventures, TCV, Greylock, Cyberstarts, Alta Park Capital","7,398",,186.18%,101-250
Believer Meats,https://www.crunchbase.com/organization/future-meat-technologies,Emerging Unicorn,"Alternative Protein, Biotechnology, Food and Beverage, Food Processing, Manufacturing, Meat and Poultry, Organic Food","Jerusalem, Yerushalayim, Israel",Believer Meats is a food technology company focused on using clean meat and cellular agriculture to replace traditional animal-based foods.,Yaakov Nahmias,387750000,USD,387750000,Series B,2021-12-17,Early Stage Venture,5,https://www.believermeats.com/,"S2G Investments, Cibus Fund, Emerald Technology Ventures, ADM Capital, Bits x Bites","7,344",,-23.83%,51-100
Planet Farms,https://www.crunchbase.com/organization/planet-farms,Emerging Unicorn,"Farming, Hydroponics, Sustainability","Milan, Lombardia, Italy",Planet Farms is vertical farming company.,"Daniele Benatoff, Luca Travaglini",54100000,EUR,58413797,Series B,2023-11-22,Early Stage Venture,4,https://www.planetfarms.ag/en,"UniCredit, Red Circle Investment, Dualcore, SACE","7,140",,173.25%,101-250
Karius,https://www.crunchbase.com/organization/karius,Emerging Unicorn,"Biotechnology, Genetics, Health Care, Information Technology, Life Science, Precision Medicine","Redwood City, California, United States","Karius delivers genomic insights into infectious diseases, helping clinicians make critical, life-saving treatment decisions.","Steve Quake, Tim Blauwkamp",354000000,USD,354000000,Series C,2024-05-02,Late Stage Venture,5,https://kariusdx.com,"General Catalyst, Khosla Ventures, Lightspeed Venture Partners, Seventure Partners, Tencent","6,860",,233.9%,101-250
SkyCell,https://www.crunchbase.com/organization/skycell,Emerging Unicorn,"Logistics, Pharmaceutical, Supply Chain Management, Transportation","Zürich, Zurich, Switzerland",SkyCell focuses on developing temperature controlled logistics containers for the pharmaceutical industry.,"Nico Ros, Richard Ettl",214669543,USD,214669543,Series D,2024-06-25,Late Stage Venture,7,http://www.skycell.ch,"Shuaa Capital psc, MVM Life Science Partners, M&G Investments, BCGE, Lazard Asset Management","6,709",,57.6%,101-250
Delos,https://www.crunchbase.com/organization/delos,Emerging Unicorn,"Commercial Real Estate, Health Care, Hospitality, Real Estate, Wellness","New York, New York, United States",Delos is a wellness real estate and technology company that provides a health-concentric development platform for interior environments.,Paul Scialla,225191698,USD,225191698,Private Equity,2024-03-22,Private Equity,9,http://www.Delos.com,"Sweetwater Capital Partners, Greybrook Realty Partners, Chaos Ventures, Cascade Investment, K20 Fund","6,614",,-49.98%,101-250
Pinwheel,https://www.crunchbase.com/organization/pinwheel-7871,Emerging Unicorn,"Financial Services, FinTech, Information Technology, Software","New York, New York, United States",Pinwheel is the market-leading payroll data connectivity platform building the income layer that will power a fairer financial system.,"Anish Basu, Curtis Lee, Kurtis Lin",77000000,USD,77000000,Series B,2022-01-18,Early Stage Venture,4,https://www.pinwheelapi.com,"Franklin Templeton, First Round Capital, Coatue, Triton Capital, TQ Ventures","6,583",,-4.02%,51-100
DEEPX,https://www.crunchbase.com/organization/deepx-c937,Emerging Unicorn,"Artificial Intelligence (AI), Information Technology, Internet of Things","Seongnam, Kyonggi-do, South Korea",DEEPX is a Korean AI hardware system solution company.,Lokwon Kim,134500000000,KRW,104269242,Series C,2024-02-25,Late Stage Venture,3,https://deepx.ai/,"Capstone Partners, Korea Development Bank, Aju IB Investment, Shinhan Capital, Pathfinder H","6,447",,-29.9%,51-100
Ule,https://www.crunchbase.com/organization/ule,Emerging Unicorn,"E-Commerce, Internet, Mobile","Shanghai, Shanghai, China","Ule.coms is an e-commerce platform offering retail and ordering services, with its focus on the online-to-offline model.","Chen Qing, Guoxiong Yang",110878637,USD,110878637,Series A,2014-02-28,Early Stage Venture,2,http://ule.com,"China Post, Access Industries, TOM Group Limited","6,311",,-48.87%,1001-5000
Madhive,https://www.crunchbase.com/organization/madhive,Emerging Unicorn,"Advertising, Information Technology, TV","New York, New York, United States",Madhive is a tech company engineered for modern TV advertising.,"Adam Helfgott, Adam Helfgott, Stacy Huggins",300000000,USD,300000000,Private Equity,2023-06-13,Private Equity,3,https://madhive.com,"Digital Currency Group, Goldman Sachs Asset Management, Kenetic","6,246",,-66.69%,501-1000
Gaosi Education Group,https://www.crunchbase.com/organization/gaosi-education-group,Emerging Unicorn,"E-Learning, Education, Primary Education, Training","Beijing, Beijing, China",Gaosi Education Group is a Chinese educational and training institution that provides services for middle and primary schools.,"Chuan Li, Jicheng Xu, Yan Wang, Yu Zou",286405998,USD,286405998,Series D,2019-11-25,Late Stage Venture,5,http://www.gaosiedu.com/,"Warburg Pincus, Tencent, Morningside, AlphaX Partners, Sinovation Ventures","6,240",,57.65%,1001-5000
Precision Neuroscience,https://www.crunchbase.com/organization/precision-neuroscience,Emerging Unicorn,"Medical, Medical Device, Neuroscience, Product Research","New York, New York, United States",Precision Neuroscience is a neural platform that engages in brain-computer interface technology.,"Benjamin Rapoport, Demetrios Papageorgiou, Mark Hettick, Michael Mager",155000000,USD,155000000,Series C,2024-12-16,Late Stage Venture,3,https://precisionneuro.io,"B Capital, Draper Associates, Alumni Ventures, Forepont Capital Partners, Mubadala Capital Ventures","6,168",,-0.93%,51-100
Submer,https://www.crunchbase.com/organization/submer,Emerging Unicorn,"CleanTech, Cloud Infrastructure, Data Center Automation, Energy Efficiency, Hardware, IT Infrastructure, Robotics","Barcelona, Catalonia, Spain",Submer enables next-generation cooling and automation for data and energy-,"Daniel Pope, Pol Valls Soler",127111469,USD,127111469,Series C,2024-12-20,Late Stage Venture,7,https://submer.com,"Santander, Norrsken VC, Alma Mundi Ventures, M&G Investments, Big Sur Ventures","6,160",,2.61%,101-250
Meati,https://www.crunchbase.com/organization/emergy-food,Emerging Unicorn,"Alternative Protein, Consumer Goods, Food and Beverage, Food Processing, Service Industry","Boulder, Colorado, United States",Meati Foods is a consumer goods company that provides fungi-based meat alternatives to everyone.,"Justin Whiteley, Tyler Huggins",374471176,USD,374471176,Series C,2024-05-08,Late Stage Venture,10,https://meati.com,"National Science Foundation, Wellington Management, Bond, Trinity Capital, Fifty Years","6,108",,-27.78%,251-500
Ninjacart,https://www.crunchbase.com/organization/ninjacart,Emerging Unicorn,"AgTech, B2B, E-Commerce, Marketing, Sales, Supply Chain Management","Bengaluru, Karnataka, India","Ninjacart is a business-to-business fresh produce supply chain that connects farmers, manufactures, and brands to retailers directly.","Ashutosh Vikram, Kartheeswaran K K, Sachin Jose, Sharath Loganathan, Thiru Nagarajan, Thirukumaran Nagarajan, Vasu Devan",357624581,USD,357624581,Series D,2022-05-18,Late Stage Venture,15,http://ninjacart.com/,"Accel, Tiger Global Management, Avaana Capital, Walmart, Trifecta Capital Advisors","6,070",,42.42%,1001-5000
K-12 Techno Services,https://www.crunchbase.com/organization/k-12-techno-services,Emerging Unicorn,"EdTech, Education, Knowledge Management","Secunderabad, Andhra Pradesh, India","K-12 Techno Services is an education technology solutions platform that offers IT support, cloud solutions, and cybersecurity services.","Jai Decosta, Venkata Narayana",88078097,USD,88078097,Venture - Series Unknown,2024-12-12,,8,http://k12technoservices.com,"Peak XV Partners, Kedaara Capital, InnoVen Capital, Venturi Partners, Kaizenvest","5,798",,197.49%,501-1000
Chalk,https://www.crunchbase.com/organization/chalk-ai,Emerging Unicorn,"Artificial Intelligence (AI), Big Data, Machine Learning, Productivity Tools, Software","San Francisco, California, United States",Chalk is a data platform for AI inference that provides the infrastructure needed to operationalize machine learning and AI.,Elliot Marx,60338298,USD,60338298,Series A,2025-05-28,Early Stage Venture,3,https://www.chalk.ai,"General Catalyst, Felicis, Xfund, Triatomic Capital, Unusual Ventures","5,721",,-93.53%,11-50
Tustin,https://www.crunchbase.com/organization/tustin,Emerging Unicorn,"Food and Beverage, Food Delivery, Food Processing","Fuhou, Fujian, China","Tustin focuses on ""hand-rolled and grilled"" items such as spicy chicken drumsticks and grilled pineapple burgers.",,,,,Seed,2023-11-23,Seed,2,https://www.tastien.com,"HSG, Source Code Capital, Buhuo Ventures","5,599",,-44.55%,
AppZen,https://www.crunchbase.com/organization/appzen,Emerging Unicorn,"Accounting, Artificial Intelligence (AI), Big Data, Enterprise Software, FinTech, Machine Learning, SaaS","San Jose, California, United States",AppZen is an artificial intelligence platform for modern finance teams.,"Anant Kale, Kunal Verma",100600000,USD,100600000,Venture - Series Unknown,2021-03-01,,7,http://www.appzen.com/,"Lightspeed Venture Partners, 500 Global, Coatue, Redpoint, Geodesic Capital","5,540",,-21.02%,251-500
Workboard,https://www.crunchbase.com/organization/workboard,Emerging Unicorn,"Business Intelligence, Enterprise Software, SaaS, Software","Redwood City, California, United States",Workboard provides an enterprise results management platform designed to automate business reviews.,"Daryoush Paknad, Deidre Paknad",141550000,USD,141550000,Series D,2021-05-04,Late Stage Venture,6,http://www.workboard.com,"Andreessen Horowitz, Floodgate, SoftBank Vision Fund, Notable Capital, Crosslink Capital","5,498",,-31.91%,101-250
HawkEye 360,https://www.crunchbase.com/organization/hawkeye-360-2,Emerging Unicorn,"Aerospace, Analytics, Wireless","Herndon, Virginia, United States",HawkEye 360 is a data analytics company that develops space-based radio frequency mapping.,"Charles Clancy, Chris DeMay, Robert McGwier",412300000,USD,412300000,Series D,2024-04-02,Late Stage Venture,11,http://www.he360.com,"BlackRock, Insight Partners, Alumni Ventures, NightDragon, Razor's Edge Ventures","5,467",,286.76%,101-250
Tessl,https://www.crunchbase.com/organization/tessl,Emerging Unicorn,"Artificial Intelligence (AI), Software, Software Engineering","London, England, United Kingdom",Tessl transforms software development for the AI era with its AI native development approach.,Guy Podjarny,125000000,USD,125000000,Series A,2024-11-14,Early Stage Venture,2,https://tesslai.uk,"Accel, Index Ventures, Google Ventures, boldstart ventures, Darkmode Ventures","5,455",,"3,893.19%",11-50
Nirvana Insurance,https://www.crunchbase.com/organization/nirvana-insurance,Emerging Unicorn,"Artificial Intelligence (AI), Financial Services, Insurance, InsurTech","San Francisco, California, United States",Nirvana Insurance is an AI-driven commercial trucking insurer that utilizes telematics data to enhance safety and reduce fleet costs.,"Abhay Mitra, Rushil Goel",162200000,USD,162200000,Series C,2025-03-10,Late Stage Venture,4,http://www.nirvanatech.com,"General Catalyst, Valor Equity Partners, Lightspeed Venture Partners","5,422",,9.19%,101-250
TIFIN,https://www.crunchbase.com/organization/the-tifin-group,Emerging Unicorn,"Artificial Intelligence (AI), Financial Services, FinTech","Boulder, Colorado, United States",TIFIN is an AI platform that develops fintech solutions focused on tailoring investment experiences to individual needs.,Vinay Nair,223325000,USD,223325000,Corporate Round,2024-02-21,,7,https://tifin.com,"Franklin Templeton, Motive Partners, Hamilton Lane, J.P. Morgan Asset Management, Morningstar","5,418",,-66.43%,251-500
Second Front Systems,https://www.crunchbase.com/organization/second-front-systems,Emerging Unicorn,"Government, Information Services, Information Technology, National Security, SaaS","Wilmington, Delaware, United States","Second Front Systems supports every step of gov & regulated network software delivery—build, accredit, operate & extend mission‑ready apps.","Mark Butler, Nate Hughes, Peter R Dixon",152100000,USD,152100000,Series C,2024-09-13,Late Stage Venture,8,https://www.secondfront.com,"Gaingels, 8VC, New Enterprise Associates, Salesforce Ventures, Kleiner Perkins","5,352",,-88.52%,101-250
UJET,https://www.crunchbase.com/organization/ujet,Emerging Unicorn,"Artificial Intelligence (AI), Cloud Data Services, Information Technology, Software","San Francisco, California, United States",UJET is a cloud-based contact center platform that provides mobile and AI-powered solutions for managing customer service operations.,"Anand Janefalkar, Hisun Kim",176600000,USD,176600000,Series D,2024-09-24,Late Stage Venture,6,https://ujet.cx,"Sapphire Ventures, Kleiner Perkins, Relay Ventures, KeyBank, Vintage Investment Partners","5,337",,8.32%,101-250
Unrivaled Sports,https://www.crunchbase.com/organization/unrivaled-sports,Emerging Unicorn,"American Football, Baseball, Sports","New York, New York, United States","Unrivaled Sports manages a diverse portfolio of youth sports properties in Baseball, Softball, Football, and Action Sports.","David Blitzer, Josh Harris",120000000,USD,120000000,Venture - Series Unknown,2025-05-06,,2,https://www.unrivaledsports.com,"TCG, LionTree, DSG Ventures, Dynasty Equity, Miller Sports & Entertainment.","5,129",,98.13%,1001-5000
Axera,https://www.crunchbase.com/organization/axera,Emerging Unicorn,"Artificial Intelligence (AI), Computer Vision, Software","Beijing, Beijing, China",Axera is a hight-tech semiconductor company focused on developing world class Artificial intelligence (AI) SoCs for computer applications.,Xiaoxin Qiu,1800000000,CNY,262076247,Series C,2025-04-09,Late Stage Venture,6,https://www.axera-tech.com/,"Qiming Venture Partners, Meituan, Legend Star, Longzhu Capital, Glory Ventures","5,057",,-45.35%,251-500
VisionNav Robotics,https://www.crunchbase.com/organization/visionnav-robotics,Emerging Unicorn,"Industrial Automation, Robotics","Acworth, Georgia, United States",Global Leading supplier of autonomous industrial vehicles and intralogistics automation solutions.,"Liu Yunhui, Luyang Li, Mu Fang, Yujie Lu",920000000,CNY,139186293,Series C,2022-04-29,Late Stage Venture,6,https://www.visionnav.com/,"Lenovo Capital and Incubator Group (LCIG), Meituan, ByteDance, IDG Capital, Shunwei Capital","5,033",,200.94%,251-500
Constructor,https://www.crunchbase.com/organization/constructor-io,Emerging Unicorn,"Artificial Intelligence (AI), Machine Learning, SaaS, Search Engine, Semantic Search","San Francisco, California, United States",Constructor is an AI-enabled product search and discovery platform that provides assistance to e-commerce brands.,"Dan McCormick, Eli Finkelshteyn",86100000,USD,86100000,Series B,2024-06-17,Early Stage Venture,5,https://www.constructor.io,"Fusion Fund, Silversmith Capital Partners, Sapphire Ventures, Zetta Venture Partners, SAP.iO","5,001",,-63.42%,101-250
AppLike,https://www.crunchbase.com/organization/applike,Emerging Unicorn,"Advertising, App Marketing, Marketing, Mobile Advertising","Hamburg, Hamburg, Germany","AppLike develops apps for all mobile devices and provides mobile advertising, app recommendation, and innovative B2B solutions.","Carlo Szelinsky, Jonas Thiemann",100000000,EUR,105036500,Venture - Series Unknown,2022-04-28,,1,https://applike-group.com,Bertelsmann Investments,"4,777",,372.27%,251-500
CyCognito,https://www.crunchbase.com/organization/cycognito,Emerging Unicorn,"Cloud Security, Cyber Security, Information Technology, Network Security, SaaS","Palo Alto, California, United States","CyCognito is a leading exposure management platform that is fully-automated & highly scalable, driven to create positive business impact","Dima Potekhin, Rob Gurzeev",153000000,USD,153000000,Series C,2021-12-01,Late Stage Venture,4,https://www.cycognito.com,"Accel, Lightspeed Venture Partners, Sorenson Capital, The Westly Group, Geodesic Capital","4,761",,-50.51%,101-250
Rebellions,https://www.crunchbase.com/organization/rebellions-ai,Emerging Unicorn,"Artificial Intelligence (AI), Machine Learning, Semiconductor, Software","Seongnam, Kyonggi-do, South Korea",Rebellions develops AI accelerators by bridging the gap between underlying silicon architectures and deep learning algorithms.,"Hyoeun Kim, Jinwook Oh, Sunghyun Park",207706703,USD,207706703,Series B,2024-01-29,Early Stage Venture,4,https://rebellions.ai,"Kakao Ventures, IMM Investment, Pavilion Capital, KB Investment, Wa’ed Ventures","4,637",,38.34%,101-250
Farther,https://www.crunchbase.com/organization/farther-finance,Emerging Unicorn,"Consulting, Finance, Financial Services, FinTech, Wealth Management","San Francisco, California, United States",Farther is a wealth management firm that combines expert financial advisors with technology to financial planning.,"Brad Genser, Taylor Matthews",118000000,USD,118000000,Series C,2024-10-10,Late Stage Venture,6,https://www.farther.com,"Lightspeed Venture Partners, Khosla Ventures, Bessemer Venture Partners, Cota Capital, MassMutual Ventures","4,516",,-46.49%,101-250
Pryon,https://www.crunchbase.com/organization/pryon,Emerging Unicorn,"Artificial Intelligence (AI), Computer Vision, Generative AI, Knowledge Management, Machine Learning","Raleigh, North Carolina, United States",Pryon is an enterprise knowledge management platform designed to simplify and accelerate the adoption of artificial intelligence.,Igor Jablokov,159127994,USD,159127994,Venture - Series Unknown,2024-01-11,,7,https://pryon.com,"Plug and Play, Gaingels, Good Growth Capital, Two Sigma Ventures, Greycroft","4,490",,-10.52%,101-250
Alloy Therapeutics,https://www.crunchbase.com/organization/alloy-therapeutics,Emerging Unicorn,"Biopharma, Biotechnology, Life Science, Therapeutics","Waltham, Massachusetts, United States",Alloy Therapeutics is a biotech company that makes medicine by democratizing access to foundational drug discovery platforms and services.,Errik Anderson,128250000,USD,128250000,Series D,2022-10-03,Late Stage Venture,3,https://www.alloytx.com,"Gaingels, Founders Fund, 8VC, Bossa Invest, Presight Capital","4,084",,106.99%,11-50
Form3,https://www.crunchbase.com/organization/form3-financial-cloud,Emerging Unicorn,"Banking, Financial Services, FinTech, Mobile Payments, Payments","London, England, United Kingdom","Form3 is a cloud native payments-as-a-service platform that designs, builds, and manages payment technology.",Michael Mueller,300236620,USD,300236620,Series C,2024-09-10,Late Stage Venture,8,https://form3.tech,"Goldman Sachs, Barclays, Visa, Nationwide, Mastercard","4,071",,2.7%,251-500
