Moonfare,https://www.crunchbase.com/organization/moonfare,Emerging Unicorn,"Asset Management, Finance, Financial Services, FinTech, Wealth Management","Berlin, Berlin, Germany","Moonfare is a digital platform that provides HNWI, family offices, banks and their advisors access to top-tier private markets investments.","Alexander Argyros, Heinrich von Liechtenstein, Steffen Pauls",175000000,USD,175000000,Series C,2023-02-07,Late Stage Venture,8,http://www.moonfare.com,"Insight Partners, Vitruvian Partners, 7GC & Co, Flixfounders, Fidelity International Strategic Ventures","85,710","77,569.67",41.05%,101-250
Servify,https://www.crunchbase.com/organization/servify,Emerging Unicorn,"Consumer Applications, Consumer Electronics, Consumer Software, Enterprise Software","Mumbai, Maharashtra, India",Servify is a self-learning platform that provides device management services and warranty solutions.,Sreevathsa Prabhakar,137690207,USD,137690207,Series D,2025-03-17,Late Stage Venture,12,https://servify.in,"Blume Ventures, Trifecta Capital Advisors, Iron Pillar, InnoVen Capital, Singularity AMC","84,592","66,391.17",-2.5%,501-1000
Augment Code,https://www.crunchbase.com/organization/augment-68db,Emerging Unicorn,"Artificial Intelligence (AI), Generative AI, Software, Web Development","Palo Alto, California, United States","Augment Code is an AI-powered platform for software development that provides services for chat, code completions, and guided edits.","Guy Gur-Ari, Igor Ostrovsky",252000000,USD,252000000,Series B,2024-11-04,Early Stage Venture,4,https://www.augmentcode.com,"Lightspeed Venture Partners, Index Ventures, Pebblebed, Innovation Endeavors, Evolution Equity Partners","83,840",,-32.46%,51-100
Dynamo Software,https://www.crunchbase.com/organization/dynamo-software,Emerging Unicorn,"Customer Service, Software","Watertown, Massachusetts, United States","Dynamo Software's configurable, Cloud-based platform consolidates front, middle and back office operations in a single system.",Krassen Draganov,,,,Private Equity,2021-09-09,M&A,1,http://www.dynamosoftware.com,"Francisco Partners, Blackstone Group","78,298","93,066.33",14.59%,51-100
Sanas,https://www.crunchbase.com/organization/sanas,Emerging Unicorn,"Language Learning, SaaS, Software, Translation Service","Palo Alto, California, United States",Sanas is a real-time speech-understanding platform that modulates accents while preserving voices and emotions for natural interactions.,"Maxim Serebryakov, Sharath Keshava Narayana",117719678,USD,117719678,Series B,2025-02-19,Early Stage Venture,7,https://sanas.ai,"General Catalyst, Insight Partners, Quiet Capital, Human Capital, Bossa Invest","76,257","37,858.5",106.82%,101-250
SecurityScorecard,https://www.crunchbase.com/organization/security-scorecard,Emerging Unicorn,"Cyber Security, Risk Management, Security, Software","New York, New York, United States",SecurityScorecard is a cybersecurity platform used for predicting and remediating potential security risks.,"Aleksandr Yampolskiy, Sam Kassoumeh",292200000,USD,292200000,Series E,2021-03-18,Late Stage Venture,8,https://securityscorecard.com/,"Sequoia Capital, NGP Capital, Two Sigma Ventures, AlleyCorp, Riverwood Capital","75,974","83,636.33",-22.09%,501-1000
LeafLink,https://www.crunchbase.com/organization/leaflink,Emerging Unicorn,"B2B, Cannabis, Marketplace, SaaS, Wholesale","New York, New York, United States",LeafLink is a wholesale management platform that connects cannabis brands and retailers.,"Ryan Smith, Zach Silverman",479000000,USD,479000000,Series D,2023-02-01,Late Stage Venture,9,http://leaflink.com,"Founders Fund, Thrive Capital, FJ Labs, Lerer Hippeau, Muse Capital","75,766","133,068.17",-15.96%,101-250
Cymulate,https://www.crunchbase.com/organization/cymulate,Emerging Unicorn,"Computer, Cyber Security, Information Services, Information Technology, Network Security, SaaS","Holon, Tel Aviv, Israel",Cymulate is a leading on-prem and cloud-based Security Validation and Exposure Management Platform,"Avihai Ben-Yossef, Eyal Gruner, Eyal Wachsman",141000000,USD,141000000,Series D,2022-09-06,Late Stage Venture,5,https://www.cymulate.com,"Vertex Ventures, One Peak, Vertex Ventures Israel, Susquehanna Growth Equity, Dell Technologies Capital","74,415","59,627",44.71%,101-250
Bungalow,https://www.crunchbase.com/organization/bungalow,Emerging Unicorn,"Communities, Real Estate, Rental, Rental Property, Residential","San Francisco, California, United States",Bungalow provides home rental services.,"Andrew Collins, Justin McCarty",171000000,USD,171000000,Series C,2021-08-24,Late Stage Venture,6,https://bungalow.com/,"Gaingels, Khosla Ventures, Wing Venture Capital, Founders Fund, Coatue","69,599","149,002.5",-25.48%,101-250
Inworld AI,https://www.crunchbase.com/organization/inworld-ai,Emerging Unicorn,"Artificial Intelligence (AI), Gaming, Generative AI, Machine Learning, Virtual Reality","Mountain View, California, United States",Inworld AI is an AI framework powering massive consumer applications.,"Ilya Gelfenbeyn, Kylan Gibbs, Michael Ermolenko",119700000,USD,119700000,Series A,2023-08-02,Early Stage Venture,6,https://inworld.ai,"Sequoia Capital, Lightspeed Venture Partners, Samsung NEXT, Founders Fund, Kleiner Perkins","65,356","109,042",-19.68%,101-250
Unit21,https://www.crunchbase.com/organization/unit21,Emerging Unicorn,"Compliance, Developer APIs, Fraud Detection, Risk Management, Software","San Francisco, California, United States",Unit21 is a no-code platform for risk and compliance operations.,"Clarence Chio, Trisha Kothari",92000000,USD,92000000,Series C,2022-06-29,Late Stage Venture,5,https://unit21.ai,"Gaingels, Village Global, South Park Commons, ICONIQ Growth, Tiger Global Management","61,659","59,548.83",-12.16%,101-250
Ocrolus,https://www.crunchbase.com/organization/ocrolus,Emerging Unicorn,"Banking, Credit, Financial Services, FinTech","New York, New York, United States",Ocrolus is an AI-powered data and analytics platform that enables faster and more accurate financial decision-making.,"John Guerci, Sam Bobley, Victoria Meakin",126966386,USD,126966386,Series C,2021-09-22,Late Stage Venture,6,https://www.ocrolus.com/,"QED Investors, Oak HC/FT, Cross River Bank, Fin Capital, Thomvest Ventures","61,309","59,349",17.13%,501-1000
Overtime,https://www.crunchbase.com/organization/overtime,Emerging Unicorn,"Digital Media, Fantasy Sports, Predictive Analytics, Sports","Brooklyn, New York, United States",Overtime is a sports network that produces several sports-focused series and short-form content for the next generation of sports fans.,"Dan Porter, Zachary Weiner",215070000,USD,215070000,Series D,2022-08-09,Late Stage Venture,9,https://overtime.tv/,"Andreessen Horowitz, BoxGroup, Gaingels, Techstars, Sapphire Ventures","60,438",,115.18%,101-250
tray.io,https://www.crunchbase.com/organization/tray,Emerging Unicorn,"Cloud Computing, Data Integration, Marketing Automation, SaaS, Sales Automation, Software","San Francisco, California, United States",Tray.io provides a cloud-based software integration platform for automators.,"Alistair Russell, Dominic Lewis",149100000,USD,149100000,Series C,2022-09-27,Late Stage Venture,9,http://tray.io,"StepStone Group, Techstars, Spark Capital, True Ventures, Redpoint","59,876","38,339.17",34.15%,101-250
Platform Science,https://www.crunchbase.com/organization/platform-science,Emerging Unicorn,"Compliance, Fleet Management, Internet of Things, SaaS, Software, Transportation","San Diego, California, United States",Platform Science provides telematics and fleet management solutions to enhance operations and driver experiences.,"Jack Kennedy, Jake Fields",322700000,USD,322700000,Series D,2024-04-09,Late Stage Venture,7,https://www.platformscience.com/,"Activant Capital, 8VC, BDT & MSD Partners, SoftBank Vision Fund, Cummins","59,870",,173.42%,251-500
Chia Network,https://www.crunchbase.com/organization/chia-network,Emerging Unicorn,"Blockchain, Cryptocurrency, FinTech","San Francisco, California, United States",Chia Network is building a blockchain platform based on Proofs of Space and Time.,Ryan Singer,69695000,USD,69695000,Series D,2021-05-24,Late Stage Venture,5,https://chia.net,"Andreessen Horowitz, Craft Ventures, Quiet Capital, Slow Ventures, True Ventures","59,553","64,484.67",7.15%,51-100
Cover Genius,https://www.crunchbase.com/organization/cover-genius,Emerging Unicorn,"Financial Services, FinTech, Insurance, InsurTech","Sydney, New South Wales, Australia",Cover Genius provides an insurance distribution platform designed to protect the customers of e-commerce companies.,"Angus McDonald, Chris Bayley",245088208,USD,245088208,Series E,2024-05-15,Late Stage Venture,7,http://www.covergenius.com,"Spark Capital, G Squared, Dawn Capital, King River Capital, Atlas Merchant Capital","59,129",,19.4%,501-1000
YuLife,https://www.crunchbase.com/organization/yu-life,Emerging Unicorn,"Employee Benefits, Insurance, Life Insurance, Wellness","London, England, United Kingdom","YuLife is building the future of insurance. Integrating health, wellbeing and engagement into insurance propositions across the world.","Jaco Oosthuizen, Jonathan Roomer, Josh Hart, Sam Fromson, Sammy Rubin",206578626,USD,206578626,Series C,2022-09-21,Late Stage Venture,5,http://yulife.com,"LocalGlobe, Creandum, Notion Capital, Anthemis, Target Global","57,516","40,663.33",112.43%,251-500
DNAnexus,https://www.crunchbase.com/organization/dnanexus,Emerging Unicorn,"Bioinformatics, Biotechnology, Cloud Computing, Medical, Software","Mountain View, California, United States",DNAnexus develops a cloud platform and global network designed for scientific collaboration and accelerated discovery.,"Andreas Sundquist, Arend Sidow, Serafim Batzoglou",472550000,USD,472550000,Series H,2022-03-08,Late Stage Venture,9,http://dnanexus.com,"Uncork Capital, First Round Capital, Felicis, Microsoft, Perceptive Advisors","56,504",,-62.97%,101-250
Spryker,https://www.crunchbase.com/organization/spryker-systems,Emerging Unicorn,"B2B, B2C, E-Commerce Platforms, Enterprise Software, Marketplace, SaaS","Berlin, Berlin, Germany",Spryker is a commerce technology platform that enables global enterprises to build transactional business models.,"Alexander Graf, Boris Lokschin, Fabian Wesner",152000000,USD,152000000,Venture - Series Unknown,2021-02-01,,4,http://spryker.com,"Cherry Ventures, TCV, One Peak, Project A Ventures, BPO Capital","55,624","48,907.83",-15.98%,251-500
Uncle Nearest,https://www.crunchbase.com/organization/uncle-nearest,Emerging Unicorn,"Consumer Goods, Food and Beverage, Wine And Spirits","Shelbyville, Tennessee, United States","Uncle Nearest is a retailer of distilled, aged, bottled, and hand-labeled whiskey.",Fawn Weaver,225000000,USD,225000000,Venture - Series Unknown,2024-02-14,,2,https://unclenearest.com,"Strand Equity Partners, Fisher Capital Investments, Still Capital Partners, Steve Mosko, Craig Leipold","54,905","60,818.67",-27.05%,51-100
Silverfort,https://www.crunchbase.com/organization/silverfort-2,Emerging Unicorn,"Cyber Security, Enterprise Software, Identity Management, Network Security","Tel Aviv, Tel Aviv, Israel","Silverfort is a unified identity protection company that offers MFA, service account protection, and identity threat detection.","Hed Kovetz, Matan Fattal, Yaron Kassner",222500000,USD,222500000,Series D,2024-01-23,Late Stage Venture,8,https://www.silverfort.com,"Acrew Capital, SixThirty, TLV Partners, Aspect Ventures, Citi Ventures","53,536","44,124",16.07%,251-500
Zinier,https://www.crunchbase.com/organization/zinier,Emerging Unicorn,"Artificial Intelligence (AI), Cloud Computing, Enterprise Applications, Enterprise Software, Field Support, Machine Learning, SaaS","San Mateo, California, United States",Zinier offers a low-code field service automation platform that provides a combined power of humans and technology.,"Andrew Wolf, Arka Dhar",120000000,USD,120000000,Series C,2020-01-15,Late Stage Venture,4,https://www.zinier.com/,"Accel, Founders Fund, ICONIQ Growth, NGP Capital, Tiger Global Management","53,251",,47.12%,11-50
ShipMonk,https://www.crunchbase.com/organization/shipmonk,Emerging Unicorn,"E-Commerce, Logistics, SaaS, Shipping, Supply Chain Management, Warehousing","Fort Lauderdale, Florida, United States",ShipMonk offers direct-to-consumer fulfillment and technology tools for e-commerce companies.,"Jan Bednar, Kevin Sides, Vash Jares",365000000,USD,365000000,Private Equity,2021-01-27,Private Equity,3,https://www.shipmonk.com,"Summit Partners, SJF Ventures, Grotech Ventures, Supply Chain Ventures, Periphas Capital","52,582","80,912.67",-4.29%,1001-5000
CloudTrucks,https://www.crunchbase.com/organization/cloudtrucks,Emerging Unicorn,"Apps, Artificial Intelligence (AI), Freight Service, Logistics, Shipping, Transportation","San Francisco, California, United States",CloudTrucks offers a virtual trucking carrier application designed to reduce operating costs for truck drivers.,"George Ezenna, Jin Shieh",141600000,USD,141600000,Series B,2021-11-30,Early Stage Venture,3,https://cloudtrucks.com/,"Menlo Ventures, Khosla Ventures, Craft Ventures, Caffeinated Capital, Abstract","48,826","53,103.17",-50.11%,101-250
Bespin Global,https://www.crunchbase.com/organization/bespin-global,Emerging Unicorn,"Big Data, Cloud Data Services, Cloud Management, Enterprise Software, Information Technology","Seoul, Seoul-t'ukpyolsi, South Korea","Bespin Global provides consulting, migration, managed services and solutions for hybrid cloud.","John HanJoo Lee, K. Hoon Park",253483185,USD,253483185,Series D,2022-12-09,Late Stage Venture,8,https://www.bespinglobal.com,"Legend Capital, Premier Partners, Altos Ventures, STIC Investment, e&","47,279","62,366.83",-28.22%,1001-5000
Legora,https://www.crunchbase.com/organization/leya-876d,Emerging Unicorn,"Artificial Intelligence (AI), Legal, Legal Tech, Software","Stockholm, Stockholms Lan, Sweden","Legora is a collaborative AI that empowers lawyers by enabling them to review documents, conduct research, and draft legal materials.","August Erséus, Max Junestrand, Sigge Labor",116000000,USD,116000000,Series B,2025-05-21,Early Stage Venture,4,https://legora.com,"Terrence Rohan, General Catalyst, Y Combinator, Redpoint, Alt Capital","46,296",,36.91%,101-250
Tomo,https://www.crunchbase.com/organization/tomo-a2ad,Emerging Unicorn,"Finance, Financial Services, FinTech, Mortgage, Real Estate","Stamford, Connecticut, United States",Tomo is a fintech startup that simplifies homebuying by optimizing mortgages and linking buyers with real estate agents.,"Carey Armstrong, Greg Schwartz",130000000,USD,130000000,Series B,2025-03-11,Early Stage Venture,5,https://www.tomo.com,"FJ Labs, NFX, Ribbit Capital, DST Global, SVB Capital","44,798","61,461",-7.85%,101-250
Viral Nation,https://www.crunchbase.com/organization/viralnation,Emerging Unicorn,"Advertising, Marketing, Social Media","Toronto, Ontario, Canada","Viral Nation is a global influencer, marketing, and talent agency.","Joe Gagliese, Mathew Micheli",250000000,CAD,197854466,Private Equity,2022-04-12,Private Equity,1,http://www.viralnation.com,"Eldridge Industries, Maverix Private Equity","44,081","29,007.33",-11.56%,101-250
Paytm Insurance,https://www.crunchbase.com/organization/paytm-insurance,Emerging Unicorn,Insurance,"New Delhi, Delhi, India",Paytm Insurance is an one-stop destination for insurance services.,,122600000,USD,122600000,Corporate Round,2021-10-27,,1,https://paytminsurance.co.in,Swiss Re,"43,689","46,988.5",-36.82%,51-100
AtoB,https://www.crunchbase.com/organization/atob,Emerging Unicorn,"FinTech, Payments, Sustainability, Transportation","San Francisco, California, United States",AtoB is a technology company building payments infrastructure for the transportation industry.,Tushar Misra,312000000,USD,312000000,Series C,2024-09-19,Late Stage Venture,6,https://www.atob.com,"General Catalyst, Y Combinator, Long Journey Ventures, Contrary, Mastercard","39,919","33,575",12.76%,101-250
Entrepreneurs First,https://www.crunchbase.com/organization/entrepreneur-first,"Crunchbase Venture Program, Emerging Unicorn","Artificial Intelligence (AI), Finance, Financial Services, FinTech, Venture Capital","London, England, United Kingdom",Entrepreneurs First brings ambitious founders together to build globally important technology companies.,"Akhilesh K. Chaurasia, Alice Bentinck, Amit Kumar, Andrej Ondracka, Anwar Jeffrey, Armins Stepanjans, Balint Pasztor, Freddie Fforde, George Proud, Juan Barragan, Masha Krol, Matt Clifford, Oliver Walerys, Pocholo Miguel Espina, Sankar Seramani, Sheetal Sinha, Siddharth Gupta, Sreenadh Narayanan, Uzay Macar, Zvezdin Besarabov",180358758,USD,180358758,Series C,2022-06-28,Late Stage Venture,5,http://www.joinef.com,"Andreessen Horowitz, Sequoia Capital, Vitruvian Partners, Founders Fund, Lakestar","39,238","36,149.33",-18.48%,101-250
Corelight,https://www.crunchbase.com/organization/corelight,Emerging Unicorn,"Analytics, Cyber Security, Network Security, Security, Software","San Francisco, California, United States",Corelight is a cybersecurity company specializing in network traffic analysis (NTA) solutions.,"Gregory Bell, Robin Sommer, Seth Hall, Vern Paxson",309200000,USD,309200000,Series E,2024-04-30,Late Stage Venture,6,https://www.corelight.com,"National Science Foundation, General Catalyst, Accel, Insight Partners, Gaingels","38,404",,-36.52%,251-500
OpenStore,https://www.crunchbase.com/organization/openstore,Emerging Unicorn,"Business Development, E-Commerce, Internet","Miami, Florida, United States","OpenStore connects merchants and customers into a single unified shopping experience through access to data, information, and capital.","Jeremy Wood, Keith Rabois, Matt Lanter, Michael Rubenstein",137000000,USD,137000000,Series B,2022-09-22,Early Stage Venture,5,https://open.store/,"General Catalyst, Khosla Ventures, Founders Fund, Lux Capital, Quiet Capital","37,715","43,396.17",-4.56%,101-250
Stark Bank,https://www.crunchbase.com/organization/starkbank,Emerging Unicorn,"Banking, Financial Services, Payments","São Paulo, Sao Paulo, Brazil",Stark Bank is a smart bank account that aids a technological advancement of a company.,Rafael Stark,59956555,USD,59956555,Series B,2022-04-11,Early Stage Venture,5,https://starkbank.com,"Y Combinator, K5 Global, Mischief, Foundation Capital, Ribbit Capital","36,869",,52.76%,51-100
ActiveFence,https://www.crunchbase.com/organization/activefence,Emerging Unicorn,"Computer, Cyber Security, SaaS, Software","New York, New York, United States",ActiveFence enables trust and safety teams to protect their platforms and users from online harm - across content formats and abuse areas.,"Alon Porat, Eyal Dykan, Iftach Orr, Noam Schwartz",100000000,USD,100000000,Series B,2021-07-27,Early Stage Venture,2,https://www.activefence.com,"Norwest Venture Partners, CRV, Highland Europe, Grove Ventures, Resolute Ventures","36,050",,-0.01%,251-500
Vouch,https://www.crunchbase.com/organization/vouch-insurance-21c4,Emerging Unicorn,"Finance, Financial Services, Insurance, InsurTech","San Francisco, California, United States",Vouch is an insurance company that provides business insurance solutions for high-growth companies through a tech-enabled platform.,,184724996,USD,184724996,Series D,2025-02-13,Late Stage Venture,8,https://www.vouch.us,"Terrence Rohan, Y Combinator, Everywhere Ventures, Alumni Ventures, Index Ventures","35,068",,-6.56%,251-500
Nile,https://www.crunchbase.com/organization/nile-secure,Emerging Unicorn,"Internet, Network Security, Wireless","San Jose, California, United States",Nile is an AI platform specializing in networking architecture and wired and wireless LAN services.,"Sri Hosakote, Suresh Katukam",300000000,USD,300000000,Series C,2023-08-01,Late Stage Venture,3,https://nilesecure.com,"8VC, Valor Equity Partners, Geodesic Capital, Aramco Ventures, Prosperity7 Ventures","34,729","32,117.17",-35.5%,251-500
Mirantis,https://www.crunchbase.com/organization/mirantis,Emerging Unicorn,"Cloud Computing, DevOps, Enterprise Software, IaaS, IT Infrastructure, Open Source","Campbell, California, United States",Mirantis is a DevOps as-a-service company that helps organizations ship code on public and private clouds on any infrastructure.,"Adrian Ionel, Alex Freedland, Boris Renski Jr.",240000000,USD,240000000,Series B,2023-10-10,Early Stage Venture,6,http://www.mirantis.com,"Insight Partners, Goldman Sachs, Sapphire Ventures, Ericsson, August Capital","34,434",,8.48%,501-1000
CAST AI,https://www.crunchbase.com/organization/cast-ai,Emerging Unicorn,"Artificial Intelligence (AI), Cloud Computing, Cloud Infrastructure, Cloud Management, Cloud Security, Developer Platform, Developer Tools, DevOps, SaaS, Software","North Miami Beach, Florida, United States","CAST AI is the leading Kubernetes automation platform that cuts AWS, Azure, and GCP customers’ cloud costs by over 50%","Augustinas Stirbis, Austeja Zymantaite, Einaras von Gravrock, Laurent Gil, Leon Kuperman, Vilius Zukauskas, Yuri Frayman",181000000,USD,181000000,Series C,2025-04-30,Late Stage Venture,6,https://www.cast.ai/,"Creandum, G2 Venture Partners, Samsung NEXT, Cota Capital, SoftBank Vision Fund","34,026","79,731.67",-48.04%,101-250
INRIX,https://www.crunchbase.com/organization/inrix,Emerging Unicorn,"Analytics, Big Data, Internet of Things, Transportation","Kirkland, Washington, United States","INRIX enables cities, people, and businesses with mobility insights by transforming big data from connected devices and vehicles.","Bryan Mistele, Craig Chapman",264100000,USD,264100000,Series F,2023-08-08,Late Stage Venture,10,http://www.inrix.com,"Bain Capital, Bain Capital Ventures, Kleiner Perkins, Venrock, General Motors","33,570","146,231.5",-26.07%,251-500
Billie,https://www.crunchbase.com/organization/billie-io,Emerging Unicorn,"E-Commerce, Finance, Financial Services, FinTech, Small and Medium Businesses","Berlin, Berlin, Germany","Billie is a fintech startup that provides Buy Now, Pay Later payment methods for the B2B market.","Aiga Senftleben, Christian Grobe, Matthias Knecht",349172542,USD,349172542,Series C,2021-10-25,Late Stage Venture,5,https://www.billie.io,"Speedinvest, Creandum, Klarna, Dawn Capital, Tencent","33,023","59,493.83",-46.17%,101-250
Nirvana,https://www.crunchbase.com/organization/nirvana-finance,Emerging Unicorn,"Blockchain, Decentralized Finance (DeFi), Financial Services, FinTech, Lending","San Francisco, California, United States",Nirvana is an AI-native financial infrastructure shaping the future of Agentic DeFi.,"Remi Gai, Tom Hou",33000000,USD,33000000,Venture - Series Unknown,2022-04-05,,4,https://parallel.fi,"Sequoia Capital, Lightspeed Venture Partners, Founders Fund, Blockchain Capital, Slow Ventures","32,480",,-39.24%,11-50
Bira 91,https://www.crunchbase.com/organization/bira-91,Emerging Unicorn,"Brewing, Craft Beer, Food and Beverage, Wine And Spirits","New Delhi, Delhi, India","Bira 91 is a craft beer manufacturer and taproom that offers a portfolio of beers made out of wheat, barley, and hops.",Ankur Jain,307933979,USD,307933979,Series D,2024-02-19,Late Stage Venture,18,http://www.bira91.com,"Sequoia Capital, Peak XV Partners, Anicut Capital, Trifecta Capital Advisors, MUFG Bank","32,366",,-17.33%,501-1000
Lithic,https://www.crunchbase.com/organization/lithic-pay,Emerging Unicorn,"Consumer, Financial Services, FinTech, Payments","New York, New York, United States",Lithic is a financial technology startup that provides virtual cards and a card issuing platform for businesses and consumers.,"Boling Jiang, David Nichols, Jason Kruse",115400000,USD,115400000,Series C,2021-07-29,Late Stage Venture,4,https://lithic.com,"Bessemer Venture Partners, Quiet Capital, Spark Capital, Index Ventures, Rocketship.vc","31,856","22,520.17",221.62%,101-250
Yeahmobi,https://www.crunchbase.com/organization/yeahmobi,Emerging Unicorn,"Ad Network, Advertising, Apps, Mobile, Mobile Advertising","Beijing, Beijing, China",Yeahmobi is an intelligent mobile advertising platform.,"Andy Sun, Jack Wang, Kevin Chen, Peter Zou, Simon Lan",131889560,USD,131889560,Series C,2016-12-19,Late Stage Venture,3,https://www.yeahmobi.com,"Xiaomi, Bohai Leasing, Jun Lei, Nanjing Huawen Hongsheng Startup Investment Fund, Shenzhen Qianhai Bochuang Private Equity Fund","31,094",,-43.13%,251-500
SoftBank Robotics Holdings,https://www.crunchbase.com/organization/softbank-robotics,Emerging Unicorn,"Information Technology, Manufacturing, Robotics","Tokyo, Tokyo, Japan",SoftBank Robotics Holdings offers robot-related products and services.,,236000000,USD,236000000,Venture - Series Unknown,2015-06-18,,1,https://www.softbankrobotics.com,"Foxconn Technology Group, Alibaba Group","30,016","28,767.67",-30.64%,101-250
League,https://www.crunchbase.com/organization/league,Emerging Unicorn,"Employee Benefits, Health Care, Health Insurance, Information Services, Medical","Toronto, Ontario, Canada",League is a healthcare consumer experience platform that connects users to a comprehensive network of health services and benefits.,"Dan Galperin, Daniel Leibu, Michael Serbinis",271139506,USD,271139506,Venture - Series Unknown,2025-02-28,,7,https://league.com,"Workday Ventures, OMERS Ventures, Foundation Capital, BDC Venture Capital, Real Ventures","29,570","38,860.33",-30.66%,501-1000
Doodles,https://www.crunchbase.com/organization/doodles-nft,Emerging Unicorn,"Blockchain, Media and Entertainment, Web3","Vancouver, British Columbia, Canada","Doodles is a web3 NFT, media, and entertainment brand.",Evan Keast,54000000,USD,54000000,Series A,2022-09-13,Early Stage Venture,1,https://doodles.app,"Seven Seven Six, Acrew Capital, 10T Holdings, FTX Ventures","29,557",,-31.09%,51-100
